{
  "operation_id": "OPERATION-EVIDENCE-BUNDLE-ASSEMBLE-001",
  "version": "1.0.0",
  "name": "Assemble governed evidence bundle",
  "service_owner_role": "Evidence service owner",
  "purpose": "Create a bounded evidence bundle from synthetic receipt identifiers and preserve a replay-stable result.",
  "effect_class": "broad_write",
  "input_contract": {
    "contract_id": "CONTRACT-EVIDENCE-BUNDLE-INPUT-001",
    "version": "1.0.0",
    "digest": "sha256:1010101010101010101010101010101010101010101010101010101010101010"
  },
  "output_contract": {
    "contract_id": "CONTRACT-EVIDENCE-BUNDLE-OUTPUT-001",
    "version": "1.0.0",
    "digest": "sha256:2020202020202020202020202020202020202020202020202020202020202020"
  },
  "scope_template": {
    "tenant_ids": [
      "TENANT-SYNTHETIC-001"
    ],
    "resource_types": [
      "evidence_bundle"
    ],
    "record_limit": 250,
    "data_classes": [
      "synthetic"
    ],
    "environment_classes": [
      "local",
      "continuous_integration"
    ]
  },
  "idempotency_policy": {
    "mode": "durable_key",
    "fingerprint_fields": [
      "tenant_id",
      "receipt_ids",
      "bundle_profile"
    ],
    "retention_seconds": 2592000,
    "replay_behavior": "return_recorded_result",
    "verification": "Twenty exact request replays return one bundle identifier and one output digest."
  },
  "approval_policy": {
    "mode": "required",
    "trigger": "Every bundle assembly writes an externally reviewable evidence projection.",
    "authority_role": "Evidence release steward",
    "validity_seconds": 3600,
    "evidence_required": [
      "input_digest",
      "scope_summary",
      "leakage_scan_result"
    ]
  },
  "resource_budget": {
    "requests_per_minute": 10,
    "timeout_seconds": 60,
    "retry_attempts": 2,
    "max_payload_bytes": 1048576
  },
  "tool_binding": {
    "tool_name": "evidence.assemble-bundle",
    "tool_version": "1.0.0",
    "implementation_digest": "sha256:3030303030303030303030303030303030303030303030303030303030303030"
  },
  "audit_fields": [
    "caller_id",
    "operation_id",
    "operation_version",
    "input_digest",
    "scope",
    "decision",
    "approval_ids",
    "effect_ids",
    "result",
    "timing",
    "correlation_id"
  ],
  "recovery": {
    "owner_role": "Evidence service owner",
    "containment": "The service quarantines an incomplete bundle and preserves its durable idempotency record.",
    "replacement_behavior": "A recovery call resumes from the recorded boundary decision and verified source receipts.",
    "verification": "The successor call returns one complete bundle and links the quarantined effect in its audit record."
  },
  "verification_checks": [
    {
      "check_id": "CHECK-OPERATION-CONTRACT-001",
      "command": [
        "python3",
        "tools/validate_governance.py",
        "--schema",
        "schemas/operation.schema.json",
        "--document",
        "examples/operation.json"
      ],
      "working_directory": "site-reading-governance",
      "expected_exit_code": 0,
      "artifact_ids": [
        "ARTIFACT-OPERATION-VALIDATION-001"
      ]
    }
  ],
  "metadata": {
    "schema_version": "3.0.0",
    "created_at": "2026-07-28T18:10:00Z",
    "updated_at": "2026-07-28T18:10:00Z",
    "owner": {
      "actor_id": "OWNER-EVIDENCE-SERVICE-001",
      "display_name": "Evidence Service Steward",
      "role": "Operation contract owner",
      "organization": "Example Laboratory"
    }
  }
}
